{
  "handle_length": "short",
  "body_length": "short",
  "grip_topology": "one_hand_handle",
  "rigidity": "rigid",
  "mass_distribution": "front",
  "contact_surface": "edge",
  "secondary_contact_surface": "point",
  "has_point": true,
  "has_edge": true,
  "has_broad_face": true,
  "has_barrel": false,
  "has_stock": false,
  "confidence": 0.88,
  "evidence_parts": [
    "wide rectangular blade",
    "straight cutting edge",
    "short wooden handle",
    "blade tip",
    "flat blade face"
  ]
}
